{
  "ibex_report": "lexer_profile",
  "schema_version": 1,
  "trust": "internal_local_observation",
  "environment": {
    "observation_role": "host_bound_not_regression_golden",
    "ruby_engine": "ruby",
    "ruby_version": "4.0.0",
    "ruby_patchlevel": 0,
    "ruby_description": "ruby 4.0.0 (2025-12-25 revision 553f1675f3) +PRISM [arm64-darwin24]",
    "ruby_platform": "arm64-darwin24",
    "rubyopt": "-r/Users/yudai.takada/.rbenv/versions/4.0.0/lib/ruby/gems/4.0.0/gems/bundler-4.0.13/lib/bundler/setup",
    "yjit_enabled": false,
    "host_os": "darwin24",
    "host_cpu": "arm64",
    "kernel_name": "Darwin",
    "kernel_release": "25.3.0",
    "kernel_version": "Darwin Kernel Version 25.3.0: Wed Jan 28 20:48:41 PST 2026; root:xnu-12377.81.4~5/RELEASE_ARM64_T6041",
    "kernel_machine": "arm64",
    "logical_processors": 12
  },
  "provenance": {
    "base_revision": "4e2ec7718c4e549bf533e9f8bb8a70f2d02001a3",
    "base_revision_role": "Exact clean capture revision and parent of the committed evidence revision",
    "capture_worktree_clean": true,
    "capture_worktree_status": [],
    "capture_worktree_status_sha256": "4f53cda18c2baa0c0354bb5f9a3ecbe5ed12ab4d8e11ba873c2f11161202b945",
    "bound_paths": [
      {
        "path": "Rakefile",
        "sha256": "7f06acab01648092cb60f25575347feecc80e34845e2d22d40f53566a7fcbcb7",
        "git_state": "base",
        "base_sha256": "7f06acab01648092cb60f25575347feecc80e34845e2d22d40f53566a7fcbcb7"
      },
      {
        "path": "docs/records/profiles/lexer-construction-profile.md",
        "sha256": "211201ebf22715b580840f1b4ae6692cb91a77aa76c3c4bf48d72a8a20ffc6b3",
        "git_state": "base",
        "base_sha256": "211201ebf22715b580840f1b4ae6692cb91a77aa76c3c4bf48d72a8a20ffc6b3"
      },
      {
        "path": "docs/registry/workloads.yml",
        "sha256": "5e3f274fae78be6f377051ec70743dcbe4dbcea88eb115acc121b20172c96350",
        "git_state": "base",
        "base_sha256": "5e3f274fae78be6f377051ec70743dcbe4dbcea88eb115acc121b20172c96350"
      },
      {
        "path": "lib/ibex/analysis.rb",
        "sha256": "66a7ce62e3e877d084deb3de720055e9e9a1f3081f9903a3c5f948bb496394b5",
        "git_state": "base",
        "base_sha256": "66a7ce62e3e877d084deb3de720055e9e9a1f3081f9903a3c5f948bb496394b5"
      },
      {
        "path": "lib/ibex/analysis/digraph.rb",
        "sha256": "470aa4ed7af53c60993044667ed74813e15c19d3f0450a3404f12c10a88f9b98",
        "git_state": "base",
        "base_sha256": "470aa4ed7af53c60993044667ed74813e15c19d3f0450a3404f12c10a88f9b98"
      },
      {
        "path": "lib/ibex/analysis/sets.rb",
        "sha256": "23356c106d47467f1d52f4d2bad4e8e29caf8a55b74fb245e6307b8275fc5027",
        "git_state": "base",
        "base_sha256": "23356c106d47467f1d52f4d2bad4e8e29caf8a55b74fb245e6307b8275fc5027"
      },
      {
        "path": "lib/ibex/codegen/action_locations.rb",
        "sha256": "39e3abb50898da471cbadd35ee8943038960c34ad58b29f2c0e9db01e64c1fdc",
        "git_state": "base",
        "base_sha256": "39e3abb50898da471cbadd35ee8943038960c34ad58b29f2c0e9db01e64c1fdc"
      },
      {
        "path": "lib/ibex/codegen/action_method_source.rb",
        "sha256": "4331c52fd0e478e864f4fa52c1c66212529fb17597f2e6b543a8d88dd4682291",
        "git_state": "base",
        "base_sha256": "4331c52fd0e478e864f4fa52c1c66212529fb17597f2e6b543a8d88dd4682291"
      },
      {
        "path": "lib/ibex/codegen/cst_metadata.rb",
        "sha256": "fc2ed04a48d7a0199d4b20967673c6f97f6e2b373e0aac616124eae286c2c6ee",
        "git_state": "base",
        "base_sha256": "fc2ed04a48d7a0199d4b20967673c6f97f6e2b373e0aac616124eae286c2c6ee"
      },
      {
        "path": "lib/ibex/codegen/generated_action_abi.rb",
        "sha256": "5c6b56e424869af9b5d921b6a6ad6093948dc6d051b22e4f2e8bbf4fbcfc755c",
        "git_state": "base",
        "base_sha256": "5c6b56e424869af9b5d921b6a6ad6093948dc6d051b22e4f2e8bbf4fbcfc755c"
      },
      {
        "path": "lib/ibex/codegen/ruby.rb",
        "sha256": "1461cddffb6487720e4eece6ebd240de3184d0711d2a79fe8b5f52c6f3959009",
        "git_state": "base",
        "base_sha256": "1461cddffb6487720e4eece6ebd240de3184d0711d2a79fe8b5f52c6f3959009"
      },
      {
        "path": "lib/ibex/codegen/ruby_actions.rb",
        "sha256": "8ccb5550a8996ee6ff18a31541d5205dde9d4837c8544cb7628e9bf4a5335460",
        "git_state": "base",
        "base_sha256": "8ccb5550a8996ee6ff18a31541d5205dde9d4837c8544cb7628e9bf4a5335460"
      },
      {
        "path": "lib/ibex/codegen/ruby_ast.rb",
        "sha256": "d7a2b97ce75a9ee3aba1097634dcb175a791e1d05ad085b1cf5e2aeffa41eab5",
        "git_state": "base",
        "base_sha256": "d7a2b97ce75a9ee3aba1097634dcb175a791e1d05ad085b1cf5e2aeffa41eab5"
      },
      {
        "path": "lib/ibex/codegen/ruby_error_messages.rb",
        "sha256": "088ef1cd4a583c80e11802f025de18e255a4fb634328c46696f0876c74808b71",
        "git_state": "base",
        "base_sha256": "088ef1cd4a583c80e11802f025de18e255a4fb634328c46696f0876c74808b71"
      },
      {
        "path": "lib/ibex/codegen/ruby_lexer.rb",
        "sha256": "683558eb0560201d6cda7dd241203375874952b803f41eb51ee7ef24bf1d9b81",
        "git_state": "base",
        "base_sha256": "683558eb0560201d6cda7dd241203375874952b803f41eb51ee7ef24bf1d9b81"
      },
      {
        "path": "lib/ibex/codegen/ruby_syntax.rb",
        "sha256": "553b4a002337b7d82fc91eec6efe3a866aa35040cba9185016d3491589cba734",
        "git_state": "base",
        "base_sha256": "553b4a002337b7d82fc91eec6efe3a866aa35040cba9185016d3491589cba734"
      },
      {
        "path": "lib/ibex/codegen/ruby_table_metadata.rb",
        "sha256": "b9df0e8ba6ced2b1d099fccb85127c9fd55ea69ce22a77c3226c3056fe955bad",
        "git_state": "base",
        "base_sha256": "b9df0e8ba6ced2b1d099fccb85127c9fd55ea69ce22a77c3226c3056fe955bad"
      },
      {
        "path": "lib/ibex/codegen/ruby_value_printers.rb",
        "sha256": "fcacd00a33b8dca75c95f3f89ec7fc655406c596f6e183224ad90c5b7d854e7b",
        "git_state": "base",
        "base_sha256": "fcacd00a33b8dca75c95f3f89ec7fc655406c596f6e183224ad90c5b7d854e7b"
      },
      {
        "path": "lib/ibex/configuration.rb",
        "sha256": "5a41045c5b0f68f9aa04398836633eef770f8c817899c7adaa013c8976523dcb",
        "git_state": "base",
        "base_sha256": "5a41045c5b0f68f9aa04398836633eef770f8c817899c7adaa013c8976523dcb"
      },
      {
        "path": "lib/ibex/configuration/analysis_grammar.rb",
        "sha256": "da24d7fdd07ec0b0238040e857998c75ede8e958db3795930687f8e8fca68f74",
        "git_state": "base",
        "base_sha256": "da24d7fdd07ec0b0238040e857998c75ede8e958db3795930687f8e8fca68f74"
      },
      {
        "path": "lib/ibex/configuration/explanation.rb",
        "sha256": "6016b85c5c55f8a0ac2bf5927de9d0d0ecb1e39386be451f9aafb39b0d98a8f9",
        "git_state": "base",
        "base_sha256": "6016b85c5c55f8a0ac2bf5927de9d0d0ecb1e39386be451f9aafb39b0d98a8f9"
      },
      {
        "path": "lib/ibex/configuration/inspector.rb",
        "sha256": "8e1aa85c3f07d9bcb1795eb7a7722debc97923b576cc901a0578652e42de0a95",
        "git_state": "base",
        "base_sha256": "8e1aa85c3f07d9bcb1795eb7a7722debc97923b576cc901a0578652e42de0a95"
      },
      {
        "path": "lib/ibex/error.rb",
        "sha256": "d9ea061a96dae780e52c6dbe947416f92ae901bd270aef587f8961cd558b623e",
        "git_state": "base",
        "base_sha256": "d9ea061a96dae780e52c6dbe947416f92ae901bd270aef587f8961cd558b623e"
      },
      {
        "path": "lib/ibex/frontend.rb",
        "sha256": "332550c378c40abdc6011d96a925ad6cf39257728b370eaece6d644f5796a981",
        "git_state": "base",
        "base_sha256": "332550c378c40abdc6011d96a925ad6cf39257728b370eaece6d644f5796a981"
      },
      {
        "path": "lib/ibex/frontend/action_scanner.rb",
        "sha256": "bc8388401500590e60699b2a23a570dc5793e372c124029c061036561a67f68d",
        "git_state": "base",
        "base_sha256": "bc8388401500590e60699b2a23a570dc5793e372c124029c061036561a67f68d"
      },
      {
        "path": "lib/ibex/frontend/ast.rb",
        "sha256": "375868cac068483b08f8e5cffe78ad4d475955c96054aa113ad19d6f364ff1d7",
        "git_state": "base",
        "base_sha256": "375868cac068483b08f8e5cffe78ad4d475955c96054aa113ad19d6f364ff1d7"
      },
      {
        "path": "lib/ibex/frontend/bootstrap_parser.rb",
        "sha256": "6131b0bc42e228c811da25186e55b690428b2b8d7ec936040e70bb5d435ee852",
        "git_state": "base",
        "base_sha256": "6131b0bc42e228c811da25186e55b690428b2b8d7ec936040e70bb5d435ee852"
      },
      {
        "path": "lib/ibex/frontend/diagnostic.rb",
        "sha256": "fa0c7df1d775ba678444eacbc52de6e0db4d4be7d500affb818859b81d784422",
        "git_state": "base",
        "base_sha256": "fa0c7df1d775ba678444eacbc52de6e0db4d4be7d500affb818859b81d784422"
      },
      {
        "path": "lib/ibex/frontend/diagnostic_recovery.rb",
        "sha256": "9ec381cdef8b0020f8f9ad811e9651c59e85b3221ac0ae41b8feeadd76d34af7",
        "git_state": "base",
        "base_sha256": "9ec381cdef8b0020f8f9ad811e9651c59e85b3221ac0ae41b8feeadd76d34af7"
      },
      {
        "path": "lib/ibex/frontend/dsl.rb",
        "sha256": "d372c12d8bd8c35edb533aac3f9349859d4f01d38eb9767c25f5d3e56747aa49",
        "git_state": "base",
        "base_sha256": "d372c12d8bd8c35edb533aac3f9349859d4f01d38eb9767c25f5d3e56747aa49"
      },
      {
        "path": "lib/ibex/frontend/formatter.rb",
        "sha256": "93c65ffab32c0ce5bdc7583bf2bc5cd8e1ca290d8fe40eceb846dabf99cc392b",
        "git_state": "base",
        "base_sha256": "93c65ffab32c0ce5bdc7583bf2bc5cd8e1ca290d8fe40eceb846dabf99cc392b"
      },
      {
        "path": "lib/ibex/frontend/generated_parser.rb",
        "sha256": "a9c909a60c9e9b44e10a417e9c80098f03217399726542936cebcfe2a35ed88a",
        "git_state": "base",
        "base_sha256": "a9c909a60c9e9b44e10a417e9c80098f03217399726542936cebcfe2a35ed88a"
      },
      {